
T:  Bus=01 Lev=00 Prnt=00 Port=00 Cnt=00 Dev#=  1 Spd=12   MxCh= 2
D:  Ver= 1.10 Cls=09(hub  ) Sub=00 Prot=00 MxPS=64 #Cfgs=  1
P:  Vendor=1d6b ProdID=0001 Rev=06.08
S:  Manufacturer=Linux 6.8.0-85-generic ohci_hcd
S:  Product=OHCI PCI host controller
S:  SerialNumber=...
C:  #Ifs= 1 Cfg#= 1 Atr=e0 MxPwr=0mA
I:  If#= 0 Alt= 0 #EPs= 1 Cls=09(hub  ) Sub=00 Prot=00 Driver=hub
E:  Ad=81(I) Atr=03(Int.) MxPS=   2 Ivl=255ms

T:  Bus=02 Lev=00 Prnt=00 Port=00 Cnt=00 Dev#=  1 Spd=480  MxCh= 2
D:  Ver= 2.00 Cls=09(hub  ) Sub=00 Prot=00 MxPS=64 #Cfgs=  1
P:  Vendor=1d6b ProdID=0002 Rev=06.08
S:  Manufacturer=Linux 6.8.0-85-generic ehci_hcd
S:  Product=EHCI Host Controller
S:  SerialNumber=...
C:  #Ifs= 1 Cfg#= 1 Atr=e0 MxPwr=0mA
I:  If#= 0 Alt= 0 #EPs= 1 Cls=09(hub  ) Sub=00 Prot=00 Driver=hub
E:  Ad=81(I) Atr=03(Int.) MxPS=   4 Ivl=256ms

T:  Bus=02 Lev=01 Prnt=01 Port=00 Cnt=01 Dev#=  2 Spd=480  MxCh= 0
D:  Ver= 2.00 Cls=ef(misc ) Sub=02 Prot=01 MxPS=64 #Cfgs=  1
P:  Vendor=0bda ProdID=49ab Rev=00.17
S:  Manufacturer=Generic
S:  Product=USB Audio
C:  #Ifs= 7 Cfg#= 1 Atr=a0 MxPwr=100mA
I:  If#= 0 Alt= 0 #EPs= 1 Cls=01(audio) Sub=01 Prot=20 Driver=snd-usb-audio
E:  Ad=87(I) Atr=03(Int.) MxPS=  16 Ivl=16ms
I:  If#= 1 Alt= 0 #EPs= 0 Cls=01(audio) Sub=02 Prot=20 Driver=snd-usb-audio
I:  If#= 2 Alt= 0 #EPs= 0 Cls=01(audio) Sub=02 Prot=20 Driver=snd-usb-audio
I:  If#= 3 Alt= 0 #EPs= 0 Cls=01(audio) Sub=02 Prot=20 Driver=snd-usb-audio
I:  If#= 4 Alt= 0 #EPs= 0 Cls=01(audio) Sub=02 Prot=20 Driver=snd-usb-audio
I:  If#= 5 Alt= 0 #EPs= 0 Cls=01(audio) Sub=02 Prot=20 Driver=snd-usb-audio
I:  If#= 6 Alt= 0 #EPs= 1 Cls=03(HID  ) Sub=00 Prot=00 Driver=usbhid
E:  Ad=88(I) Atr=03(Int.) MxPS=  16 Ivl=1ms

T:  Bus=03 Lev=00 Prnt=00 Port=00 Cnt=00 Dev#=  1 Spd=480  MxCh= 2
D:  Ver= 2.00 Cls=09(hub  ) Sub=00 Prot=01 MxPS=64 #Cfgs=  1
P:  Vendor=1d6b ProdID=0002 Rev=06.08
S:  Manufacturer=Linux 6.8.0-85-generic xhci-hcd
S:  Product=xHCI Host Controller
S:  SerialNumber=...
C:  #Ifs= 1 Cfg#= 1 Atr=e0 MxPwr=0mA
I:  If#= 0 Alt= 0 #EPs= 1 Cls=09(hub  ) Sub=00 Prot=00 Driver=hub
E:  Ad=81(I) Atr=03(Int.) MxPS=   4 Ivl=256ms

T:  Bus=03 Lev=01 Prnt=01 Port=00 Cnt=01 Dev#=  2 Spd=480  MxCh= 4
D:  Ver= 2.10 Cls=09(hub  ) Sub=00 Prot=02 MxPS=64 #Cfgs=  1
P:  Vendor=0bda ProdID=5411 Rev=01.01
S:  Manufacturer=Generic
S:  Product=4-Port USB 2.1 Hub
C:  #Ifs= 1 Cfg#= 1 Atr=e0 MxPwr=0mA
I:  If#= 0 Alt= 1 #EPs= 1 Cls=09(hub  ) Sub=00 Prot=02 Driver=hub
E:  Ad=81(I) Atr=03(Int.) MxPS=   1 Ivl=256ms

T:  Bus=03 Lev=01 Prnt=02 Port=01 Cnt=01 Dev#=  3 Spd=12   MxCh= 0
D:  Ver= 2.00 Cls=02(commc) Sub=01 Prot=01 MxPS=64 #Cfgs=  1
P:  Vendor=27c6 ProdID=5117 Rev=02.00
S:  Manufacturer=Shenzhen Goodix Technology Co.,Ltd.
S:  Product=Goodix Fingerprint Device 
C:  #Ifs= 2 Cfg#= 1 Atr=60 MxPwr=100mA
I:  If#= 0 Alt= 0 #EPs= 1 Cls=02(commc) Sub=01 Prot=01 Driver=(none)
E:  Ad=82(I) Atr=03(Int.) MxPS=   8 Ivl=16ms
I:  If#= 1 Alt= 0 #EPs= 2 Cls=0a(data ) Sub=00 Prot=00 Driver=(none)
E:  Ad=01(O) Atr=02(Bulk) MxPS=  64 Ivl=0ms
E:  Ad=81(I) Atr=02(Bulk) MxPS=  64 Ivl=0ms

T:  Bus=04 Lev=00 Prnt=00 Port=00 Cnt=00 Dev#=  1 Spd=5000 MxCh= 2
D:  Ver= 3.00 Cls=09(hub  ) Sub=00 Prot=03 MxPS= 9 #Cfgs=  1
P:  Vendor=1d6b ProdID=0003 Rev=06.08
S:  Manufacturer=Linux 6.8.0-85-generic xhci-hcd
S:  Product=xHCI Host Controller
S:  SerialNumber=...
C:  #Ifs= 1 Cfg#= 1 Atr=e0 MxPwr=0mA
I:  If#= 0 Alt= 0 #EPs= 1 Cls=09(hub  ) Sub=00 Prot=00 Driver=hub
E:  Ad=81(I) Atr=03(Int.) MxPS=   4 Ivl=256ms

T:  Bus=04 Lev=01 Prnt=01 Port=00 Cnt=01 Dev#=  2 Spd=5000 MxCh= 4
D:  Ver= 3.10 Cls=09(hub  ) Sub=00 Prot=03 MxPS= 9 #Cfgs=  1
P:  Vendor=0bda ProdID=0411 Rev=01.01
S:  Manufacturer=Generic
S:  Product=4-Port USB 3.1 Hub
C:  #Ifs= 1 Cfg#= 1 Atr=e0 MxPwr=0mA
I:  If#= 0 Alt= 0 #EPs= 1 Cls=09(hub  ) Sub=00 Prot=00 Driver=hub
E:  Ad=81(I) Atr=13(Int.) MxPS=   2 Ivl=16ms

T:  Bus=05 Lev=00 Prnt=00 Port=00 Cnt=00 Dev#=  1 Spd=480  MxCh= 1
D:  Ver= 2.00 Cls=09(hub  ) Sub=00 Prot=01 MxPS=64 #Cfgs=  1
P:  Vendor=1d6b ProdID=0002 Rev=06.08
S:  Manufacturer=Linux 6.8.0-85-generic xhci-hcd
S:  Product=xHCI Host Controller
S:  SerialNumber=...
C:  #Ifs= 1 Cfg#= 1 Atr=e0 MxPwr=0mA
I:  If#= 0 Alt= 0 #EPs= 1 Cls=09(hub  ) Sub=00 Prot=00 Driver=hub
E:  Ad=81(I) Atr=03(Int.) MxPS=   4 Ivl=256ms

T:  Bus=05 Lev=01 Prnt=01 Port=00 Cnt=01 Dev#=  2 Spd=480  MxCh= 4
D:  Ver= 2.10 Cls=09(hub  ) Sub=00 Prot=02 MxPS=64 #Cfgs=  1
P:  Vendor=0bda ProdID=5411 Rev=01.01
S:  Manufacturer=Generic
S:  Product=4-Port USB 2.1 Hub
C:  #Ifs= 1 Cfg#= 1 Atr=e0 MxPwr=0mA
I:  If#= 0 Alt= 1 #EPs= 1 Cls=09(hub  ) Sub=00 Prot=02 Driver=hub
E:  Ad=81(I) Atr=03(Int.) MxPS=   1 Ivl=256ms

T:  Bus=06 Lev=00 Prnt=00 Port=00 Cnt=00 Dev#=  1 Spd=5000 MxCh= 1
D:  Ver= 3.00 Cls=09(hub  ) Sub=00 Prot=03 MxPS= 9 #Cfgs=  1
P:  Vendor=1d6b ProdID=0003 Rev=06.08
S:  Manufacturer=Linux 6.8.0-85-generic xhci-hcd
S:  Product=xHCI Host Controller
S:  SerialNumber=...
C:  #Ifs= 1 Cfg#= 1 Atr=e0 MxPwr=0mA
I:  If#= 0 Alt= 0 #EPs= 1 Cls=09(hub  ) Sub=00 Prot=00 Driver=hub
E:  Ad=81(I) Atr=03(Int.) MxPS=   4 Ivl=256ms

T:  Bus=06 Lev=01 Prnt=01 Port=00 Cnt=01 Dev#=  2 Spd=5000 MxCh= 4
D:  Ver= 3.10 Cls=09(hub  ) Sub=00 Prot=03 MxPS= 9 #Cfgs=  1
P:  Vendor=0bda ProdID=0411 Rev=01.01
S:  Manufacturer=Generic
S:  Product=4-Port USB 3.1 Hub
C:  #Ifs= 1 Cfg#= 1 Atr=e0 MxPwr=0mA
I:  If#= 0 Alt= 0 #EPs= 1 Cls=09(hub  ) Sub=00 Prot=00 Driver=hub
E:  Ad=81(I) Atr=13(Int.) MxPS=   2 Ivl=16ms
